{
  "state_name": "Texas",
  "state_code": "TX",
  "last_updated": "2025-11-14",
  "data_sources": {
    "dmv_url": "https://www.txdmv.gov",
    "tax_authority_url": "https://comptroller.texas.gov",
    "labor_department_url": "https://www.twc.texas.gov",
    "education_department_url": "https://www.thecb.state.tx.us",
    "consumer_protection_url": "https://www.texasattorneygeneral.gov/consumer-protection",
    "property_tax_assessor_url": "https://comptroller.texas.gov/taxes/property-tax/"
  },
  "automotive": {
    "registration_initial": 50.75,
    "registration_annual": 50.75,
    "avg_auto_loan_rate_new": 6.72,
    "avg_auto_loan_rate_used": 7.48,
    "insurance_avg_teen": 245,
    "insurance_comparison_url": "https://www.tdi.texas.gov/consumer/",
    "lease_acquisition_fee": 695,
    "inspection_required": true,
    "inspection_cost": 25.50,
    "gas_price_current": 2.89,
    "dmv_url": "https://www.txdmv.gov"
  },
  "taxes": {
    "sales_tax": 6.25,
    "local_sales_tax_min": 0,
    "local_sales_tax_max": 2.0,
    "combined_sales_tax_min": 6.25,
    "combined_sales_tax_max": 8.25,
    "local_sales_tax_examples": [
      {
        "city": "Houston",
        "local_rate": 2.0,
        "combined_rate": 8.25
      },
      {
        "city": "Austin",
        "local_rate": 2.0,
        "combined_rate": 8.25
      },
      {
        "city": "Dallas",
        "local_rate": 2.0,
        "combined_rate": 8.25
      },
      {
        "city": "San Antonio",
        "local_rate": 1.375,
        "combined_rate": 7.625
      },
      {
        "city": "Lubbock",
        "local_rate": 1.5,
        "combined_rate": 7.75
      }
    ],
    "allows_local_income_tax": false,
    "local_income_tax_range": "N/A - Texas has no income tax",
    "local_income_tax_rate_low": 0,
    "local_income_tax_rate_high": 0,
    "local_income_tax_example": "N/A",
    "property_tax_county_rate": 0.45,
    "property_tax_school_rate": 1.25,
    "property_tax_special_rate": 0.15,
    "property_tax_city_range": "0.30 - 0.75%",
    "property_tax_examples": [
      {
        "location": "Austin (Travis County)",
        "millage": 23.6,
        "description": "High tax area - urban, excellent schools"
      },
      {
        "location": "Houston (Harris County - Houston ISD)",
        "millage": 21.4,
        "description": "Major city - varied districts"
      },
      {
        "location": "Dallas (Dallas County - Dallas ISD)",
        "millage": 24.2,
        "description": "High urban property taxes"
      },
      {
        "location": "San Antonio (Bexar County)",
        "millage": 19.8,
        "description": "Medium tax area"
      },
      {
        "location": "Lubbock (Lubbock County)",
        "millage": 17.5,
        "description": "Lower tax rural/suburban area"
      },
      {
        "location": "Plano (Collin County)",
        "millage": 18.9,
        "description": "Suburban - excellent schools, moderate taxes"
      },
      {
        "location": "Rural West Texas",
        "millage": 14.2,
        "description": "Low tax rural area"
      }
    ],
    "assessment_percentage": 100,
    "homestead_exemption": 100000,
    "property_assessment_frequency": "Annual",
    "assessment_appeal_process": "File protest with county appraisal district by May 15 or within 30 days of notice. Informal hearing first, then ARB hearing if unresolved.",
    "assessment_appeal_deadline": "May 15 or 30 days after notice",
    "assessment_appeal_form_url": "https://comptroller.texas.gov/taxes/property-tax/forms/",
    "has_tax_cap": true,
    "county_name": "Travis County",
    "county_assessor_contact": "Travis Central Appraisal District - (512) 834-9317",
    "county_tax_assessor_url": "https://www.traviscad.org",
    "property_tax_lookup_url": "https://comptroller.texas.gov/taxes/property-tax/",
    "tax_incentives": "Texas Tuition Promise Fund (prepaid tuition), Texas College Savings Plan (529), no state income tax benefits property owners and businesses",
    "tax_structure": "No state income tax; relies heavily on property and sales taxes. Property taxes among highest in nation."
  },
  "housing": {
    "median_home_price": 303000,
    "median_rent": 1395,
    "housing_market_trends": "Moderately rising - strong population growth, particularly in major metros (Austin, Dallas, Houston). Affordable compared to coastal states.",
    "first_time_homebuyer_program": "Texas State Affordable Housing Corporation (TSAHC) - My First Texas Home program offers down payment assistance and competitive rates",
    "avg_mortgage_rate_30yr": 7.12
  },
  "employment": {
    "min_wage": 7.25,
    "unemployment_rate": 4.1,
    "major_industries": "Energy (Oil & Gas), Technology, Healthcare, Agriculture, Manufacturing, Aerospace"
  },
  "education": {
    "tuition_public": 11678
  },
  "banking": {
    "avg_monthly_fee": 12,
    "avg_overdraft_fee": 34,
    "credit_union_association_url": "https://www.tcul.coop",
    "minor_banking_rules": "Minors can open accounts with parent/guardian co-signer. Parent must be present for account opening."
  },
  "consumer_protection": {
    "consumer_protection_agency": "Texas Attorney General - Consumer Protection Division",
    "consumer_protection_url": "https://www.texasattorneygeneral.gov/consumer-protection"
  },
  "local_examples": {
    "major_retailers": "H-E-B, Buc-ee's, Academy Sports, Target, Walmart",
    "telecom_providers": "AT&T, Spectrum, Frontier, T-Mobile, Verizon",
    "utility_providers": "CenterPoint Energy, Oncor, AEP Texas, Texas Gas Service",
    "healthcare_market": "Large marketplace with multiple insurers; Houston Medical Center is world's largest medical complex",
    "local_credit_union_name": "University Federal Credit Union",
    "local_nonprofit_name": "Central Texas Food Bank",
    "major_city": "Houston",
    "major_city_1": "Houston",
    "major_city_2": "Austin",
    "major_city_3": "Dallas",
    "major_city_1_millage": 21.4,
    "major_city_2_millage": 23.6,
    "major_city_3_millage": 24.2,
    "suburb_city": "Plano",
    "suburb_1": "Plano",
    "suburb_2": "Sugar Land",
    "suburb_1_millage": 18.9,
    "suburb_2_millage": 20.1,
    "rural_area": "West Texas (Lubbock area)",
    "rural_area_millage": 14.2,
    "high_tax_city": "Dallas",
    "medium_tax_city": "San Antonio",
    "low_tax_city": "Lubbock",
    "high_tax_major_city": "Dallas",
    "low_tax_medium_city": "Lubbock",
    "high_tax_millage": 24.2,
    "medium_tax_millage": 19.8,
    "low_tax_millage": 14.2,
    "high_combined_sales_tax": 8.25,
    "low_combined_sales_tax": 6.25,
    "high_local_sales_tax": 2.0,
    "low_local_sales_tax": 0,
    "local_sales_tax_1": 2.0,
    "total_millage_example": 21.4,
    "high_local_income_tax_rate": 0,
    "low_local_income_tax_rate": 0,
    "local_income_tax_rate": 0,
    "local_income_tax_rate_1": 0
  },
  "notes": "Texas has no state income tax, which makes it attractive for businesses and high-income individuals. However, property taxes are among the highest in the nation to compensate. State is experiencing rapid population growth, particularly in major metro areas (Austin, Dallas, Houston), driving housing costs up but still remaining more affordable than California or New York. Energy sector is major employer but transitioning to include more renewable energy alongside traditional oil/gas."
}
